{
  "schemaVersion": 1,
  "id": "felicia-simos2p",
  "comment": "Felicia 1.3 MPI 50 kW, 1999, four injectors, A/C and immobilizer. Numbered raw measurements use the ECU conversion header. Remaining uncertainties are annotated on the affected fields.",
  "vehicle": {
    "model": "Skoda Felicia hatchback",
    "year": 1999,
    "engine": "1.3 MPI Simos 2P",
    "powerKw": 50,
    "injectors": 4,
    "equipment": {
      "ac": true,
      "immobilizer": true,
      "abs": false,
      "powerSteering": false,
      "centralLocking": false
    }
  },
  "settings": {
    "baudRate": 10400,
    "fieldComments": {
      "baudRate": "Default connection rate. Override it with a numeric CLI rate or KW1281TEST_BAUD_RATE if needed."
    }
  },
  "units": [
    {
      "address": "0x01",
      "aliases": [
        "ecu",
        "engine"
      ],
      "present": true,
      "measurements": {
        "engine": {
          "rpm": {
            "label": "Engine speed",
            "readFrom": {
              "group": 5,
              "position": 1
            },
            "includeInSensors": true,
            "unit": "rpm"
          },
          "temp": {
            "label": "Coolant temperature",
            "readFrom": {
              "group": 5,
              "position": 3
            },
            "includeInSensors": true,
            "unit": "°C"
          },
          "conditions": {
            "label": "Adjustment conditions",
            "readFrom": {
              "group": 1,
              "position": 4
            },
            "includeInSensors": true,
            "comment": "Status bits are decoded from the ECU byte mask. Unknown bits remain visible.",
            "raw": {
              "bits": [
                {
                  "mask": 128,
                  "set": "Diagnostic fault affecting throttle adjustment"
                },
                {
                  "mask": 32,
                  "set": "A/C compressor on",
                  "clear": "A/C compressor off"
                },
                {
                  "mask": 16,
                  "set": "Idle switch closed",
                  "clear": "Idle switch open"
                },
                {
                  "mask": 8,
                  "set": "Lambda regulation fault"
                },
                {
                  "mask": 4,
                  "set": "Throttle control not closed"
                },
                {
                  "mask": 2,
                  "set": "Engine running",
                  "clear": "Engine stopped"
                },
                {
                  "mask": 1,
                  "set": "Coolant below 80°C",
                  "clear": "Coolant at least 80°C"
                }
              ]
            }
          },
          "state": {
            "label": "Engine operating state",
            "readFrom": {
              "group": 2,
              "position": 4
            },
            "includeInSensors": true,
            "comment": "Status bits are decoded from the ECU byte mask. Unknown bits remain visible.",
            "raw": {
              "bits": [
                {
                  "mask": 8,
                  "set": "Deceleration"
                },
                {
                  "mask": 4,
                  "set": "Idle"
                },
                {
                  "mask": 2,
                  "set": "Partial load"
                },
                {
                  "mask": 1,
                  "set": "Full load"
                }
              ],
              "zero": "No operating mode reported"
            }
          },
          "idle": {
            "targetRpm": {
              "label": "Target idle speed",
              "readFrom": {
                "group": 8,
                "position": 2
              },
              "includeInSensors": true,
              "unit": "rpm"
            },
            "correction": {
              "label": "Idle regulation",
              "readFrom": {
                "group": 8,
                "position": 3
              },
              "includeInSensors": true,
              "unit": "%"
            }
          }
        },
        "electrical": {
          "voltage": {
            "label": "Battery voltage",
            "readFrom": {
              "group": 5,
              "position": 2
            },
            "includeInSensors": true,
            "unit": "V"
          }
        },
        "intake": {
          "temp": {
            "label": "Intake air temperature",
            "readFrom": {
              "group": 5,
              "position": 4
            },
            "includeInSensors": true,
            "unit": "°C"
          },
          "pressure": {
            "label": "Intake manifold absolute pressure",
            "readFrom": {
              "group": 0,
              "position": 4
            },
            "includeInSensors": true,
            "unit": "kPa",
            "comment": "Pressure is available only when group 000 returns its ten measurement bytes."
          },
          "throttle": {
            "angle": {
              "label": "Throttle angle",
              "readFrom": {
                "group": 3,
                "position": 3
              },
              "includeInSensors": true,
              "unit": "degrees"
            },
            "duty": {
              "label": "Throttle positioner duty cycle",
              "readFrom": {
                "group": 3,
                "position": 4
              },
              "includeInSensors": true,
              "unit": "%"
            },
            "state": {
              "label": "Throttle control unit status",
              "readFrom": {
                "group": 9,
                "position": 2
              },
              "includeInSensors": true,
              "comment": "Status bits are decoded from the ECU byte mask. Unknown bits remain visible.",
              "raw": {
                "bits": [
                  {
                    "mask": 8,
                    "set": "Throttle adaptation error"
                  },
                  {
                    "mask": 4,
                    "set": "Throttle drive unpowered"
                  },
                  {
                    "mask": 2,
                    "set": "Throttle adaptation cancelled by low battery voltage"
                  },
                  {
                    "mask": 1,
                    "set": "Idle switch open"
                  }
                ],
                "zero": "No throttle control flags"
              }
            },
            "voltage": {
              "label": "Throttle potentiometer voltage",
              "readFrom": {
                "group": 98,
                "position": 1
              },
              "includeInSensors": true,
              "unit": "V"
            },
            "positionerVoltage": {
              "label": "Throttle positioner potentiometer voltage",
              "readFrom": {
                "group": 98,
                "position": 2
              },
              "includeInSensors": true,
              "unit": "V"
            }
          },
          "altitudeCorrection": {
            "label": "Altitude correction factor",
            "readFrom": {
              "group": 6,
              "position": 4
            },
            "includeInSensors": true
          }
        },
        "fuel": {
          "injection": {
            "duration": {
              "label": "Injection duration",
              "readFrom": {
                "group": 4,
                "position": 3
              },
              "includeInSensors": true,
              "unit": "ms",
              "comment": "One injection duration is reported for the engine. Separate durations for the four injectors are unavailable."
            }
          },
          "lambda": {
            "correction": {
              "label": "Lambda regulation",
              "readFrom": {
                "group": 10,
                "position": 1
              },
              "includeInSensors": true,
              "unit": "%"
            },
            "voltage": {
              "label": "Lambda sensor voltage",
              "readFrom": {
                "group": 1,
                "position": 3
              },
              "includeInSensors": true,
              "unit": "V"
            },
            "idleAdaptation": {
              "label": "Idle lambda adaptation",
              "readFrom": {
                "group": 11,
                "position": 2
              },
              "includeInSensors": true,
              "unit": "ms"
            },
            "partialAdaptation": {
              "label": "Partial-load lambda adaptation",
              "readFrom": {
                "group": 11,
                "position": 3
              },
              "includeInSensors": true
            },
            "state": {
              "label": "Lambda regulation status",
              "readFrom": {
                "group": 20,
                "position": 4
              },
              "includeInSensors": true,
              "comment": "The mixture-bit direction still needs confirmation. Other flags show the stored-fault, dynamic-range, limit, active and ready states.",
              "raw": {
                "bits": [
                  {
                    "mask": 128,
                    "set": "Fault stored"
                  },
                  {
                    "mask": 16,
                    "set": "Reduced dynamic range"
                  },
                  {
                    "mask": 8,
                    "set": "Regulation limit reached"
                  },
                  {
                    "mask": 4,
                    "set": "Regulation active",
                    "clear": "Regulation inactive"
                  },
                  {
                    "mask": 2,
                    "set": "Sensor ready",